{
  "strategy_id": "strat_akosmicanimals_001",
  "business_id": "biz_akosmicanimals",
  "title": "Build AKosmicAnimals into a repeatable, profitable cat-themed apparel brand",
  "objective": "Build AKosmicAnimals into a repeatable, profitable cat-themed apparel brand that serves as the reference business for Hermes OS.",
  "owner": "AVANZIA",
  "status": "active",
  "review_frequency": "monthly",
  "created_at": "2026-07-19T09:00:00Z",
  "updated_at": "2026-07-19T09:00:00Z"
}
